[
  { "spelling": "a",     "combines_with": ["countable_singular"], "polarity": ["affirmative", "negative", "interrogative"], "verb_agreement": "singular", "article_slot": true,
    "notes": "只接可数单数；辅音音开头名词。", "provenance": { "source": "curated_by_agent", "reviewed": true, "confidence": "high", "checked_at": "2026-07-30" } },
  { "spelling": "an",    "combines_with": ["countable_singular"], "polarity": ["affirmative", "negative", "interrogative"], "verb_agreement": "singular", "article_slot": true,
    "notes": "只接可数单数；元音音开头名词，见 article_phonetics.json。", "provenance": { "source": "curated_by_agent", "reviewed": true, "confidence": "high", "checked_at": "2026-07-30" } },
  { "spelling": "the",   "combines_with": ["countable_singular", "countable_plural", "uncountable"], "polarity": ["affirmative", "negative", "interrogative"], "verb_agreement": "follows_noun", "article_slot": true,
    "provenance": { "source": "curated_by_agent", "reviewed": true, "confidence": "high", "checked_at": "2026-07-30" } },
  { "spelling": "many",  "combines_with": ["countable_plural"], "polarity": ["affirmative", "negative", "interrogative"], "verb_agreement": "plural", "article_slot": true,
    "provenance": { "source": "curated_by_agent", "reviewed": true, "confidence": "high", "checked_at": "2026-07-30" } },
  { "spelling": "few",   "combines_with": ["countable_plural"], "polarity": ["affirmative", "negative"], "verb_agreement": "plural", "article_slot": true,
    "notes": "few 含否定意味；a few 是另一结构，暂不铺。", "provenance": { "source": "curated_by_agent", "reviewed": true, "confidence": "high", "checked_at": "2026-07-30" } },
  { "spelling": "much",  "combines_with": ["uncountable"], "polarity": ["negative", "interrogative"], "verb_agreement": "singular", "article_slot": true,
    "notes": "肯定句中 much 常被 a lot of 替代，第一版限否定/疑问。", "provenance": { "source": "curated_by_agent", "reviewed": true, "confidence": "high", "checked_at": "2026-07-30" } },
  { "spelling": "little", "combines_with": ["uncountable"], "polarity": ["affirmative", "negative"], "verb_agreement": "singular", "article_slot": true,
    "notes": "little 含否定意味（几乎没有）。", "provenance": { "source": "curated_by_agent", "reviewed": true, "confidence": "high", "checked_at": "2026-07-30" } },
  { "spelling": "this",  "combines_with": ["countable_singular", "uncountable"], "polarity": ["affirmative", "negative", "interrogative"], "verb_agreement": "singular", "article_slot": true,
    "provenance": { "source": "curated_by_agent", "reviewed": true, "confidence": "high", "checked_at": "2026-07-30" } },
  { "spelling": "that",  "combines_with": ["countable_singular", "uncountable"], "polarity": ["affirmative", "negative", "interrogative"], "verb_agreement": "singular", "article_slot": true,
    "provenance": { "source": "curated_by_agent", "reviewed": true, "confidence": "high", "checked_at": "2026-07-30" } },
  { "spelling": "these", "combines_with": ["countable_plural"], "polarity": ["affirmative", "negative", "interrogative"], "verb_agreement": "plural", "article_slot": true,
    "provenance": { "source": "curated_by_agent", "reviewed": true, "confidence": "high", "checked_at": "2026-07-30" } },
  { "spelling": "those", "combines_with": ["countable_plural"], "polarity": ["affirmative", "negative", "interrogative"], "verb_agreement": "plural", "article_slot": true,
    "provenance": { "source": "curated_by_agent", "reviewed": true, "confidence": "high", "checked_at": "2026-07-30" } },
  { "spelling": "each",  "combines_with": ["countable_singular"], "polarity": ["affirmative", "negative", "interrogative"], "verb_agreement": "singular", "article_slot": true,
    "provenance": { "source": "curated_by_agent", "reviewed": true, "confidence": "high", "checked_at": "2026-07-30" } },
  { "spelling": "every", "combines_with": ["countable_singular"], "polarity": ["affirmative", "negative", "interrogative"], "verb_agreement": "singular", "article_slot": true,
    "provenance": { "source": "curated_by_agent", "reviewed": true, "confidence": "high", "checked_at": "2026-07-30" } },
  { "spelling": "some",  "combines_with": ["countable_plural", "uncountable"], "polarity": ["affirmative"], "verb_agreement": "follows_noun", "article_slot": true,
    "notes": "疑问句表请求（Would you like some tea?）第一版不铺，统一按肯定处理。", "provenance": { "source": "curated_by_agent", "reviewed": true, "confidence": "high", "checked_at": "2026-07-30" } },
  { "spelling": "any",   "combines_with": ["countable_plural", "uncountable"], "polarity": ["negative", "interrogative"], "verb_agreement": "follows_noun", "article_slot": true,
    "provenance": { "source": "curated_by_agent", "reviewed": true, "confidence": "high", "checked_at": "2026-07-30" } },
  { "spelling": "no",    "combines_with": ["countable_singular", "countable_plural", "uncountable"], "polarity": ["affirmative"], "verb_agreement": "follows_noun", "article_slot": true,
    "notes": "no 本身构成否定意义，句子形式为肯定式（There is no water）。", "provenance": { "source": "curated_by_agent", "reviewed": true, "confidence": "high", "checked_at": "2026-07-30" } },
  { "spelling": "several", "combines_with": ["countable_plural"], "polarity": ["affirmative", "negative", "interrogative"], "verb_agreement": "plural", "article_slot": true,
    "provenance": { "source": "curated_by_agent", "reviewed": true, "confidence": "high", "checked_at": "2026-07-30" } }
]
